{
  "checked_at": "2024-01-01T00:00:00Z",
  "diagnostics": [
    {
      "capability": null,
      "code": "ROOT_MARKER_MISSING",
      "evidence": [
        "<BASE>\\doctor_recovery\\root\\state\\root.json"
      ],
      "impact": "the root cannot be trusted or selected",
      "remediation": "recover",
      "severity": "critical"
    },
    {
      "capability": null,
      "code": "REGISTRY_PROJECTION_STALE",
      "evidence": [
        "state/registry.json is missing or unreadable"
      ],
      "impact": "agents reading the projection see no declared state",
      "remediation": "rebuild",
      "severity": "warning"
    },
    {
      "capability": null,
      "code": "POLICY_ONLY_MODE",
      "evidence": [
        "P1 has no ACL, broker or machine PATH exposure"
      ],
      "impact": "enforcement is convention and audit only; a same-user process can bypass it",
      "remediation": "none",
      "severity": "info"
    }
  ],
  "enforcement": "same_user_can_bypass",
  "registry_generation": 0,
  "root_instance_id": "unknown",
  "schema_version": 1,
  "security_mode": "policy_only",
  "status": "recovery_required"
}
