{
  "checked_at": "2024-01-01T00:00:00Z",
  "diagnostics": [
    {
      "capability": null,
      "code": "POLICY_ONLY_MODE",
      "evidence": [
        "P1 has no ACL, broker or machine PATH exposure"
      ],
      "impact": "enforcement is convention and audit only; a same-user process can bypass it",
      "remediation": "none",
      "severity": "info"
    }
  ],
  "enforcement": "same_user_can_bypass",
  "registry_generation": 0,
  "root_instance_id": "root-4f2a9c1d8e3b",
  "schema_version": 1,
  "security_mode": "policy_only",
  "status": "healthy"
}
